{
  "eventId": "e_3a1f0c9d8b7e6a5f4c3b2a1908f7e6d5",
  "type": "transcript.partial",
  "version": 1,
  "sessionId": "s_7f3a9c21",
  "tenantId": "t_9c21a4be",
  "sequence": 14,
  "occurredAt": "2026-09-24T10:00:03.412Z",
  "payload": {
    "segmentId": "sg_4be1f07a93c25d18",
    "speaker": { "kind": "human", "participantId": "p_4b81e0d7" },
    "text": "मुझे कल की मीटिंग",
    "language": "hi-IN",
    "source": { "provider": "sarvam", "model": "saaras:v3-realtime" }
  }
}
