{
  "eventId": "e_5c4b3a2918f7e6d5c4b3a2918f7e6d5c",
  "type": "transcript.version_created",
  "version": 1,
  "sessionId": "s_7f3a9c21",
  "tenantId": "t_9c21a4be",
  "sequence": 0,
  "occurredAt": "2026-09-24T10:31:12.004Z",
  "payload": {
    "pass": "batch",
    "language": "hi",
    "provenance": {
      "provider": "sarvam",
      "model": "saaras:v3",
      "configHash": "0d6a3c1f5e9b2d7a4c8e1f3b5d7a9c2e4f6b8d0a1c3e5f7b9d2a4c6e8f0b1d3a",
      "createdAt": "2026-09-24T10:31:12.004Z",
      "recordings": [
        {
          "recordingId": "EG_Kx9r2QmT4bZa",
          "speaker": {
            "kind": "human",
            "participantId": "p_4b81e0d7"
          },
          "startedAt": "2026-09-24T10:00:01.500Z"
        },
        {
          "recordingId": "EG_Lw3s8PnV6cYb",
          "speaker": {
            "kind": "human",
            "participantId": "p_9c21a4be"
          },
          "startedAt": "2026-09-24T10:00:02.250Z"
        }
      ]
    },
    "verbatim": [
      {
        "speaker": {
          "kind": "human",
          "participantId": "p_4b81e0d7"
        },
        "recordingId": "EG_Kx9r2QmT4bZa",
        "startMs": 1210,
        "endMs": 3480,
        "text": "मुझे कल की मीटिंग का टाइम बताओ",
        "language": "hi-IN"
      },
      {
        "speaker": {
          "kind": "human",
          "participantId": "p_9c21a4be"
        },
        "recordingId": "EG_Lw3s8PnV6cYb",
        "startMs": 2900,
        "endMs": 4710,
        "text": "उम्म दस बजे है ना",
        "language": "hi-IN"
      }
    ],
    "clean": [
      {
        "speaker": {
          "kind": "human",
          "participantId": "p_4b81e0d7"
        },
        "recordingId": "EG_Kx9r2QmT4bZa",
        "startMs": 1210,
        "endMs": 3480,
        "text": "मुझे कल की मीटिंग का टाइम बताओ।",
        "language": "hi-IN"
      },
      {
        "speaker": {
          "kind": "human",
          "participantId": "p_9c21a4be"
        },
        "recordingId": "EG_Lw3s8PnV6cYb",
        "startMs": 2900,
        "endMs": 4710,
        "text": "10 बजे है ना?",
        "language": "hi-IN"
      }
    ],
    "transcriptHash": "4010587f3b7e5c5efc778288684a658a53c3266c6a572909d1b157b1d44efe9a"
  }
}
